{
  "schema_version": 1,
  "status": "M12 PRIVATE VAEG QUALIFICATION PENDING",
  "child_commit": "7ee01776d0acfdb08b0aee0b2b4a8446e0efbb57",
  "vaeg_commit": "7dd453cbd36014ba453a26765b00cd0cc9a99655",
  "artifact_manifest": {
    "path": "qa/golden/m12/manifest.json",
    "sha256": "a60c707a3a5b593c74e205e9d74a63b2a10f65cf337c3d213ccecb84f391e2ed"
  },
  "main_runs": [
    {
      "boundaries": [
        "R0",
        "R1",
        "R2",
        "R3",
        "R4",
        "R5",
        "R6",
        "R7",
        "R8",
        "R9"
      ],
      "projection_equal": false,
      "inputs_preserved": false,
      "exact_sector_bytes": false,
      "no_write_commands": false
    },
    {
      "boundaries": [
        "R0",
        "R1",
        "R2",
        "R3",
        "R4",
        "R5",
        "R6",
        "R7",
        "R8",
        "R9"
      ],
      "projection_equal": false,
      "inputs_preserved": false,
      "exact_sector_bytes": false,
      "no_write_commands": false
    }
  ],
  "error_runs": [
    {
      "boundaries": [
        "E0",
        "E1",
        "E2",
        "E3",
        "E4"
      ],
      "projection_equal": false,
      "inputs_preserved": false,
      "exact_sector_bytes": false,
      "no_write_commands": false
    },
    {
      "boundaries": [
        "E0",
        "E1",
        "E2",
        "E3",
        "E4"
      ],
      "projection_equal": false,
      "inputs_preserved": false,
      "exact_sector_bytes": false,
      "no_write_commands": false
    }
  ],
  "two_main_runs_equal": false,
  "two_error_runs_equal": false,
  "actual_schema_instances_valid": false,
  "production_memory_trace": false,
  "private_execution_in_public_ci": false,
  "hardware_run": false,
  "evidence_retention": "persistent_ignored",
  "writes_attempted": false
}
